rank,companyName,careersUrl,regionPriority,priorityTier,whyImportant,notes
380,Zapier,https://zapier.com/jobs,US/Canada/Remote,1,"Automation platform with remote software product and operations roles","Automation/remote priority"
381,Make,https://www.make.com/en/careers,US/Canada/Global,3,"Automation platform with engineering product and operations roles","Automation source"
382,Grammarly,https://www.grammarly.com/jobs,US/Canada/Remote,1,"AI writing platform with engineering ML product and business roles","AI productivity priority"
383,Duolingo,https://careers.duolingo.com,US/Canada,2,"Consumer edtech company with software ML product and data roles","Edtech/AI source"
384,Coursera,https://about.coursera.org/careers,US/Canada/Remote,2,"Edtech platform with software product data and operations roles","Edtech source"
385,Udemy,https://about.udemy.com/careers,US/Canada,3,"Edtech marketplace with software product data and business roles","Edtech source"
386,MasterClass,https://careers.masterclass.com,US/Canada,3,"Consumer education/media company with product engineering and content roles","Edtech/media source"
387,Synthesia,https://www.synthesia.io/careers,US/Canada/Global,2,"AI video company with ML engineering product and go-to-market roles","AI video source"
388,Pika,https://pika.art/careers,US/Canada,2,"AI video generation company with ML product and engineering roles","AI video source"
389,Midjourney,https://www.midjourney.com/careers,US/Canada,2,"AI image generation company with research engineering and product roles","AI creative tools source"
390,Ideogram,https://ideogram.ai/careers,Canada/US,2,"Toronto AI image generation company with ML and engineering roles","Canada AI priority"
391,Stability AI,https://stability.ai/careers,US/Canada/Remote,3,"Generative AI company with ML engineering and product roles","AI source"
392,Writer,https://writer.com/careers,US/Canada,2,"Enterprise generative AI company with engineering product and sales roles","Enterprise AI source"
393,Jasper,https://www.jasper.ai/careers,US/Canada,3,"AI marketing platform with product engineering and go-to-market roles","AI marketing source"
394,Glean,https://www.glean.com/careers,US/Canada,1,"Enterprise AI search company with engineering ML and product roles","Enterprise AI priority"
395,Hebbia,https://www.hebbia.ai/careers,US/Canada,2,"AI knowledge work platform with engineering ML and product roles","Enterprise AI source"
396,LangChain,https://www.langchain.com/careers,US/Canada/Remote,2,"LLM developer tools company with infrastructure and AI engineering roles","AI developer tools source"
397,LlamaIndex,https://www.llamaindex.ai/careers,US/Canada/Remote,2,"LLM data framework company with AI infrastructure and developer tools roles","AI developer tools source"
398,Together AI,https://www.together.ai/careers,US/Canada,1,"AI infrastructure company with model serving research and systems roles","AI infrastructure priority"
399,Fireworks AI,https://fireworks.ai/careers,US/Canada,2,"AI inference platform with systems ML and infrastructure roles","AI infrastructure source"
400,Modal,https://modal.com/careers,US/Canada,2,"Cloud platform for AI workloads with infrastructure and developer tools roles","AI/cloud infrastructure source"
401,Baseten,https://www.baseten.co/careers,US/Canada,2,"AI model deployment platform with ML infrastructure and product roles","AI infrastructure source"
402,Replicate,https://replicate.com/careers,US/Canada/Remote,2,"AI model hosting platform with infrastructure and developer tools roles","AI infrastructure source"
403,Anyscale,https://www.anyscale.com/careers,US/Canada,2,"AI distributed computing platform with ML infrastructure engineering roles","AI infrastructure source"
404,CoreWeave,https://www.coreweave.com/careers,US/Canada,1,"AI cloud infrastructure company with high-growth data center and engineering roles","AI cloud priority"
405,Lambda,https://lambdalabs.com/careers,US/Canada,2,"GPU cloud company with AI infrastructure hardware and software roles","AI cloud source"
406,Cerebras,https://www.cerebras.ai/careers,US/Canada,2,"AI hardware and systems company with ML compiler and infrastructure roles","AI hardware source"
407,Groq,https://groq.com/careers,US/Canada,2,"AI inference hardware company with compiler systems and software roles","AI hardware/inference source"
408,SambaNova,https://sambanova.ai/careers,US/Canada,3,"AI systems company with ML hardware software and enterprise roles","AI systems source"
409,Tenstorrent,https://tenstorrent.com/careers,Canada/US,2,"AI chip company with Canada and US engineering roles","Canada AI hardware source"
410,D-Wave,https://www.dwavesys.com/company/careers,Canada/US,3,"Canadian quantum computing company with software research and engineering roles","Canada quantum source"
411,IonQ,https://ionq.com/careers,US/Canada,3,"Quantum computing company with software research and engineering roles","Quantum source"
412,Rigetti Computing,https://www.rigetti.com/careers,US/Canada,3,"Quantum computing company with engineering research and software roles","Quantum source"
413,PsiQuantum,https://www.psiquantum.com/careers,US/Canada,3,"Quantum computing company with hardware software and research roles","Quantum source"
414,NotCo,https://notco.com/careers,US/Canada/Global,3,"AI foodtech company with data product operations and science roles","Foodtech/AI source"
415,Carbon Health,https://carbonhealth.com/careers,US,3,"Healthcare company with product data operations and technology roles","Healthtech source"
416,Commure,https://www.commure.com/careers,US/Canada,2,"Healthcare software company with engineering product data and operations roles","Healthtech source"
417,Abridge,https://www.abridge.com/careers,US/Canada,2,"AI healthcare documentation company with ML engineering and product roles","AI healthtech source"
418,Nabla,https://www.nabla.com/careers,US/Canada/Remote,3,"AI clinical assistant company with software ML and product roles","AI healthtech source"
419,Hippocratic AI,https://www.hippocraticai.com/careers,US/Canada,3,"Healthcare AI company with product ML and operations roles","AI healthtech source"
420,Ambience Healthcare,https://www.ambiencehealthcare.com/careers,US/Canada,3,"AI healthcare documentation company with engineering ML and product roles","AI healthtech source"